{
  "$schema": "../schemas/deployment.schema.json",
  "name": "elara-dev",
  "description": "Elara internal development environment",

  "aws": {
    "accountId": "925445553972",
    "region": "ap-southeast-2",
    "profile": "elaraai-dev-elara-e3"
  },

  "deployment": {
    "id": "dev"
  },

  "domain": {
    "baseDomain": "e3.elaraai.com",
    "hostedZoneId": "Z10452251PCGZVRQ2N81E",
    "route53RoleArn": "arn:aws:iam::064741130885:role/E3-Route53-CrossAccount"
  },

  "oidc": {
    "providerName": "EntraID",
    "clientId": "ecd3a920-ef9a-495c-b1ef-f5c8ce71304a",
    "issuerUrl": "https://login.microsoftonline.com/f6e3d4a6-dd46-4950-ba59-d96255494980/v2.0",
    "clientSecretArn": "arn:aws:secretsmanager:ap-southeast-2:925445553972:secret:/e3/auth/oidc/client-secret-b82R5B"
  }
}
